{
  "schemaVersion": 1,
  "groups": [
    {
      "id": "g-1",
      "label": "German Chancellors",
      "collapsed": false
    }
  ],
  "rows": [
    {
      "id": "row-1",
      "groupId": "g-1",
      "color": "#dd0000",
      "icon": "🇩🇪",
      "label": "Chancellor of Germany"
    }
  ],
  "entries": [
    {
      "id": "e-1",
      "rowId": "row-1",
      "title": "Helmut Schmidt",
      "subtitle": "SPD",
      "description": "Led West Germany through the oil crises and the 'German Autumn' of Red Army Faction terrorism.",
      "start": {
        "ms": 137894400000,
        "precision": "day"
      },
      "end": {
        "ms": 402278400000,
        "precision": "day"
      }
    },
    {
      "id": "e-2",
      "rowId": "row-1",
      "title": "Helmut Kohl",
      "subtitle": "CDU",
      "description": "Oversaw German reunification in 1990, becoming the first chancellor of a reunified Germany.",
      "start": {
        "ms": 402278400000,
        "precision": "day"
      },
      "end": {
        "ms": 909446400000,
        "precision": "day"
      }
    },
    {
      "id": "e-3",
      "rowId": "row-1",
      "title": "Gerhard Schröder",
      "subtitle": "SPD",
      "description": "Pushed through the Agenda 2010 labor market reforms and opposed the Iraq War.",
      "start": {
        "ms": 909446400000,
        "precision": "day"
      },
      "end": {
        "ms": 1132617600000,
        "precision": "day"
      }
    },
    {
      "id": "e-4",
      "rowId": "row-1",
      "title": "Angela Merkel",
      "subtitle": "CDU",
      "description": "Germany's first female chancellor, serving 16 years through the Eurozone crisis, the 2015 refugee crisis, and COVID-19.",
      "start": {
        "ms": 1132617600000,
        "precision": "day"
      },
      "end": {
        "ms": 1638921600000,
        "precision": "day"
      }
    },
    {
      "id": "e-5",
      "rowId": "row-1",
      "title": "Olaf Scholz",
      "subtitle": "SPD",
      "description": "Led a three-party coalition through the energy crisis triggered by Russia's invasion of Ukraine.",
      "start": {
        "ms": 1638921600000,
        "precision": "day"
      },
      "end": {
        "ms": 1746489600000,
        "precision": "day"
      }
    },
    {
      "id": "e-6",
      "rowId": "row-1",
      "title": "Friedrich Merz",
      "subtitle": "CDU",
      "description": "Elected chancellor after a snap election, on a second ballot after failing to secure a majority on the first.",
      "start": {
        "ms": 1746489600000,
        "precision": "day"
      }
    }
  ]
}
