{
  "schemaVersion": 1,
  "groups": [
    {
      "id": "g-1",
      "label": "Tech Firsts",
      "collapsed": false
    }
  ],
  "rows": [
    {
      "id": "row-1",
      "groupId": "g-1",
      "color": "#4a6fa5",
      "icon": "💡",
      "label": "Computing, Internet & AI"
    }
  ],
  "entries": [
    {
      "id": "e-1",
      "rowId": "row-1",
      "title": "ENIAC unveiled",
      "description": "The first general-purpose electronic digital computer was publicly demonstrated in Philadelphia.",
      "start": {
        "ms": -753580800000,
        "precision": "day"
      },
      "subtitle": "Philadelphia, USA"
    },
    {
      "id": "e-2",
      "rowId": "row-1",
      "title": "UNIVAC I delivered",
      "description": "The first commercially produced computer in the United States was delivered to the US Census Bureau.",
      "start": {
        "ms": -585446400000,
        "precision": "day"
      },
      "subtitle": "Remington Rand"
    },
    {
      "id": "e-3",
      "rowId": "row-1",
      "title": "Spacewar! released",
      "description": "Widely regarded as the first widely-shared digital video game, created for lab computers by MIT students.",
      "start": {
        "ms": -236822400000,
        "precision": "year"
      },
      "subtitle": "MIT"
    },
    {
      "id": "e-4",
      "rowId": "row-1",
      "title": "First email sent",
      "description": "Ray Tomlinson sent the first network email between two computers on ARPANET, establishing the 'user@host' address format.",
      "start": {
        "ms": 47174400000,
        "precision": "year"
      },
      "subtitle": "Ray Tomlinson, ARPANET"
    },
    {
      "id": "e-5",
      "rowId": "row-1",
      "title": "Intel 4004 released",
      "description": "The first commercially available single-chip microprocessor went on sale.",
      "start": {
        "ms": 59011200000,
        "precision": "day"
      },
      "subtitle": "Intel"
    },
    {
      "id": "e-6",
      "rowId": "row-1",
      "title": "Altair 8800 launched",
      "description": "The first commercially successful personal computer kit sparked the home-computing hobbyist movement.",
      "start": {
        "ms": 158976000000,
        "precision": "month"
      },
      "subtitle": "MITS"
    },
    {
      "id": "e-7",
      "rowId": "row-1",
      "title": "First website goes live",
      "description": "Tim Berners-Lee published info.cern.ch, the first website, at CERN.",
      "start": {
        "ms": 681436800000,
        "precision": "day"
      },
      "subtitle": "Tim Berners-Lee, CERN"
    },
    {
      "id": "e-8",
      "rowId": "row-1",
      "title": "IBM Simon released",
      "description": "The first device widely recognized as a smartphone combined a mobile phone with calendar, email, and touchscreen apps.",
      "start": {
        "ms": 776908800000,
        "precision": "month"
      },
      "subtitle": "IBM"
    },
    {
      "id": "e-9",
      "rowId": "row-1",
      "title": "First tweet posted",
      "description": "Twitter co-founder Jack Dorsey posted the platform's first message: 'just setting up my twttr'.",
      "start": {
        "ms": 1142899200000,
        "precision": "day"
      },
      "subtitle": "Jack Dorsey"
    },
    {
      "id": "e-10",
      "rowId": "row-1",
      "title": "First iPhone unveiled",
      "description": "Steve Jobs introduced the iPhone, merging a phone, iPod, and internet device into one touchscreen product.",
      "start": {
        "ms": 1168300800000,
        "precision": "day"
      },
      "subtitle": "Steve Jobs, Apple"
    },
    {
      "id": "e-11",
      "rowId": "row-1",
      "title": "ChatGPT launches publicly",
      "description": "OpenAI's public release of ChatGPT brought conversational AI to mainstream use almost overnight.",
      "start": {
        "ms": 1669766400000,
        "precision": "day"
      },
      "subtitle": "OpenAI"
    }
  ]
}
